Product Title,Product Price,Rating,Number of Reviews,Availability
The Woman in Me,,4.5 out of 5 stars,"17,334 ratings",In Stock
"Fourth Wing (The Empyrean, 1)",,4.8 out of 5 stars,"109,516 ratings",In Stock
My Name Is Barbra,,4.6 out of 5 stars,105 ratings,In Stock
"Iron Flame (The Empyrean, 2)",,4.7 out of 5 stars,"12,614 ratings",
How to Catch a Turkey,,4.8 out of 5 stars,"5,003 ratings",In Stock
"Friends, Lovers, and the Big Terrible Thing: A Memoir",,4.5 out of 5 stars,"28,668 ratings",Usually ships within 1 to 4 weeks
No Brainer (Diary of a Wimpy Kid Book 18),,4.8 out of 5 stars,"1,038 ratings",In Stock
The Great Disappearance: 31 Ways to be Rapture Ready,,4.7 out of 5 stars,381 ratings,In Stock
How to Catch a Snowman,,4.8 out of 5 stars,"3,082 ratings",In Stock
Taylor Swift: A Little Golden Book Biography,,4.9 out of 5 stars,"4,725 ratings",In Stock
Killers of the Flower Moon: The Osage Murders and the Birth of the FBI,,4.4 out of 5 stars,"59,541 ratings",In Stock
Unwoke: How to Defeat Cultural Marxism in America,,3.8 out of 5 stars,28 ratings,Only 10 left in stock - order soon.
All the Light We Cannot See: A Novel,,4.5 out of 5 stars,"217,779 ratings",In Stock
Lessons in Chemistry: A Novel,,4.6 out of 5 stars,"237,107 ratings",In Stock
The Ballad of Songbirds and Snakes (a Hunger Games Novel) (Hunger Games),,4.6 out of 5 stars,"70,103 ratings",In Stock
The 48 Laws of Power,,4.7 out of 5 stars,"71,004 ratings",In Stock
Teddy and Booker T.: How Two American Icons Blazed a Path for Racial Equality,,5.0 out of 5 stars,4 ratings,In Stock
Atomic Habits: An Easy & Proven Way to Build Good Habits & Break Bad Ones,,4.8 out of 5 stars,"118,682 ratings",In Stock
Don't Let the Pigeon Drive the Sleigh!,,4.8 out of 5 stars,268 ratings,In Stock
"Hello, Baby Animals: A Durable High-Contrast Black-and-White Board Book for Newborns and Babies (High-Contrast Books)",,4.9 out of 5 stars,"5,586 ratings",In Stock
How to Catch a Reindeer,,4.8 out of 5 stars,852 ratings,In Stock
Murtagh: The World of Eragon (The Inheritance Cycle),,4.8 out of 5 stars,199 ratings,In Stock
Prequel: An American Fight Against Fascism,,4.7 out of 5 stars,655 ratings,In Stock
Being Henry: The Fonz . . . and Beyond,,4.6 out of 5 stars,247 ratings,In Stock
The Exchange: After The Firm (The Firm Series),,4.1 out of 5 stars,"13,680 ratings",In Stock
"The Body Keeps the Score: Brain, Mind, and Body in the Healing of Trauma",,4.8 out of 5 stars,"70,865 ratings",In Stock
Turkey Trouble,,4.8 out of 5 stars,"6,690 ratings",In Stock
"World of Eric Carle, Around the Farm 30-Button Animal Sound Book - Great for First Words - PI Kids",,4.8 out of 5 stars,"21,810 ratings",In Stock
How to Catch an Elf,,4.8 out of 5 stars,"8,121 ratings",In Stock
"The Psychology of Money: Timeless lessons on wealth, greed, and happiness",,4.7 out of 5 stars,"43,463 ratings",In Stock
